{
  "topic_id": "topic-2026-03-001",
  "core_story": "一个看似小众的 AI 人物或事件，揭示出真正的创业优势并不来自工具本身，而来自洞察和组织方式。",
  "counterintuitive_insight": "越多人追逐同一个 AI 热点，真正有价值的不是复述热点，而是重新定义它和创业结果之间的因果关系。",
  "force_claw_link": "把热点翻译成原力创业语境下的借势、势能和路径判断。",
  "target_platforms": [
    "xiaohongshu",
    "wechat_video"
  ],
  "tone_constraints": [
    "先讲故事，再讲道理",
    "要猎奇，但不能低俗",
    "反认知要有证据支撑",
    "结尾自然回到原力创业"
  ]
}
